<?xml version="1.0" encoding="UTF-8"?>
<!DOCTYPE schedule SYSTEM "schedule.dtd">

<schedule>
	<info>
		<program>CST</program>
		<year>2016</year>
		<term>4</term>
		<set>G</set>
	</info>
	
	<!-- Courses -->
	<courses>
		<course name="COMP" number="4711">
			<booking type="Lecture" start="8:30am" end="9:20am" day="Monday">
				<building>SW5</building>
				<room>1850</room>
				<instructor>
					<firstname>Jim</firstname>
					<lastname>Parry</lastname>
				</instructor>
			</booking>
			
			<booking type="Lab" start="12:30pm" end="2:20pm" day="Tuesday">
				<building>SE12</building>
				<room>320</room>
				<instructor>
					<firstname>Jim</firstname>
					<lastname>Parry</lastname>
				</instructor>
			</booking>
		</course>
		
	</courses>

	<!-- Daysoftheweek -->
	<days>
		<day day_of_the_week = "Monday">
			<booking type="Lecture" start="8:30am" end="9:20am" course="COMP4711">
				<building>SW5</building>
				<room>1850</room>
				<instructor>
					<firstname>Jim</firstname>
					<lastname>Parry</lastname>
				</instructor>
			</booking>

			<booking type="Lecture" start="4:30pm" end="5:20pm" course="COMP4711">
				<building>SW5</building>
				<room>1851</room>
				<instructor>
					<firstname>Bernie</firstname>
					<lastname>Sanders</lastname>
				</instructor>
			</booking>
		</day>
	</days>

	<!-- timeslots -->
	<timeslots>
		<hour start="8:30am">
			<booking type="Lecture" course="COMP4711" day="Monday">
				<building>SW5</building>
				<room>1850</room>
				<instructor>
					<firstname>Jim</firstname>
					<lastname>Parry</lastname>
				</instructor>
			</booking>
			<booking type="Lecture" course="COMP4711" day="Tuesday">
				<building>SW5</building>
				<room>1851</room>
				<instructor>
					<firstname>Paul</firstname>
					<lastname>John</lastname>
				</instructor>
			</booking>
		</hour>
	</timeslots>
	
</schedule>